{
  "lesson_id": "lesson_010",
  "title": "Greetings",
  "level": "beginner",
  "language": "en",
  "duration_sec": 6.4,
  "speaker": "teacher_alex",
  "audio_file": "lesson_010.mp3",
  "recording_date": "2025-11-13",
  "segments": [
    {
      "start_sec": 0.0,
      "end_sec": 1.6,
      "text": "Good morning"
    },
    {
      "start_sec": 1.6,
      "end_sec": 3.2,
      "text": "Good afternoon"
    },
    {
      "start_sec": 3.2,
      "end_sec": 4.8,
      "text": "Good evening"
    },
    {
      "start_sec": 4.8,
      "end_sec": 6.4,
      "text": "Good night"
    }
  ]
}