{
  "lesson_id": "lesson_005",
  "title": "Days of the Week",
  "level": "beginner",
  "language": "en",
  "duration_sec": 5.6,
  "speaker": "teacher_lisa",
  "audio_file": "lesson_005.mp3",
  "recording_date": "2025-11-13",
  "segments": [
    {
      "start_sec": 0.0,
      "end_sec": 0.8,
      "text": "Monday"
    },
    {
      "start_sec": 0.8,
      "end_sec": 1.6,
      "text": "Tuesday"
    },
    {
      "start_sec": 1.6,
      "end_sec": 2.4,
      "text": "Wednesday"
    },
    {
      "start_sec": 2.4,
      "end_sec": 3.2,
      "text": "Thursday"
    },
    {
      "start_sec": 3.2,
      "end_sec": 4.0,
      "text": "Friday"
    },
    {
      "start_sec": 4.0,
      "end_sec": 4.8,
      "text": "Saturday"
    },
    {
      "start_sec": 4.8,
      "end_sec": 5.6,
      "text": "Sunday"
    }
  ]
}