{
  "lesson_id": "lesson_006",
  "title": "Food and Drinks",
  "level": "beginner",
  "language": "en",
  "duration_sec": 3.2,
  "speaker": "teacher_tom",
  "audio_file": "lesson_006.mp3",
  "recording_date": "2025-11-13",
  "segments": [
    {
      "start_sec": 0.0,
      "end_sec": 0.8,
      "text": "Apple"
    },
    {
      "start_sec": 0.8,
      "end_sec": 1.6,
      "text": "Water"
    },
    {
      "start_sec": 1.6,
      "end_sec": 2.4,
      "text": "Bread"
    },
    {
      "start_sec": 2.4,
      "end_sec": 3.2,
      "text": "Milk"
    }
  ]
}