{
  "lesson_id": "lesson_004",
  "title": "Colors",
  "level": "beginner",
  "language": "en",
  "duration_sec": 3.2,
  "speaker": "teacher_mike",
  "audio_file": "lesson_004.mp3",
  "recording_date": "2025-11-13",
  "segments": [
    {
      "start_sec": 0.0,
      "end_sec": 0.8,
      "text": "Red"
    },
    {
      "start_sec": 0.8,
      "end_sec": 1.6,
      "text": "Blue"
    },
    {
      "start_sec": 1.6,
      "end_sec": 2.4,
      "text": "Green"
    },
    {
      "start_sec": 2.4,
      "end_sec": 3.2,
      "text": "Yellow"
    }
  ]
}